[
  {
    "schemaVersion": "1.0",
    "toolId": "git",
    "applicable": true,
    "found": true,
    "executable": "C:\\Program Files\\Git\\cmd\\git.exe",
    "rawVersion": "git version 2.53.0.windows.1",
    "normalizedVersion": "2.53.0",
    "minimumVersion": "2.20.0",
    "meetsMinimum": true,
    "candidateExecutables": [
      "C:\\Program Files\\Git\\cmd\\git.exe"
    ],
    "selectedScope": "EXISTING_APPROVED",
    "selectionReason": "resolved on PATH; approved existing installation",
    "status": "AVAILABLE",
    "checkedAt": "2026-08-13T10:39:52Z"
  },
  {
    "schemaVersion": "1.0",
    "toolId": "dotnet-sdk",
    "applicable": true,
    "found": true,
    "executable": "C:\\Program Files\\dotnet\\dotnet.exe",
    "rawVersion": "10.0.400-preview.0.26322.102",
    "normalizedVersion": "10.0.400",
    "minimumVersion": "8.0.0",
    "meetsMinimum": true,
    "candidateExecutables": [
      "C:\\Program Files\\dotnet\\dotnet.exe"
    ],
    "selectedScope": "EXISTING_APPROVED",
    "selectionReason": "resolved on PATH; approved existing installation",
    "status": "AVAILABLE",
    "checkedAt": "2026-08-13T10:39:53Z"
  },
  {
    "schemaVersion": "1.0",
    "toolId": "node",
    "applicable": true,
    "found": true,
    "executable": "C:\\Program Files\\nodejs\\node.exe",
    "rawVersion": "v14.20.0",
    "normalizedVersion": "14.20.0",
    "minimumVersion": "14.0.0",
    "meetsMinimum": true,
    "candidateExecutables": [
      "C:\\Program Files\\nodejs\\node.exe"
    ],
    "selectedScope": "EXISTING_APPROVED",
    "selectionReason": "resolved on PATH; approved existing installation",
    "status": "AVAILABLE",
    "checkedAt": "2026-08-13T10:39:53Z"
  },
  {
    "schemaVersion": "1.0",
    "toolId": "npm",
    "applicable": true,
    "found": true,
    "executable": "C:\\Program Files\\nodejs\\npm",
    "rawVersion": "6.14.17",
    "normalizedVersion": "6.14.17",
    "minimumVersion": "6.0.0",
    "meetsMinimum": true,
    "candidateExecutables": [
      "C:\\Program Files\\nodejs\\npm"
    ],
    "selectedScope": "EXISTING_APPROVED",
    "selectionReason": "resolved on PATH; approved existing installation",
    "status": "AVAILABLE",
    "checkedAt": "2026-08-13T10:39:54Z"
  },
  {
    "schemaVersion": "1.0",
    "toolId": "tar",
    "applicable": true,
    "found": true,
    "executable": "C:\\Windows\\System32\\tar.exe",
    "rawVersion": "bsdtar 3.8.4 - libarchive 3.8.4 zlib/1.2.13.1-motley liblzma/5.8.1 bz2lib/1.0.8 libzstd/1.5.7 cng/2.0 libb2/bundled",
    "normalizedVersion": "3.8.4",
    "minimumVersion": null,
    "meetsMinimum": true,
    "candidateExecutables": [
      "C:\\Windows\\System32\\tar.exe"
    ],
    "selectedScope": "EXISTING_APPROVED",
    "selectionReason": "resolved on PATH; approved existing installation",
    "status": "AVAILABLE",
    "checkedAt": "2026-08-13T10:39:55Z"
  },
  {
    "schemaVersion": "1.0",
    "toolId": "ripgrep",
    "applicable": true,
    "found": false,
    "executable": null,
    "rawVersion": null,
    "normalizedVersion": null,
    "minimumVersion": null,
    "meetsMinimum": null,
    "candidateExecutables": [],
    "selectedScope": null,
    "selectionReason": "not found; fallback available: git-grep-or-findstr",
    "status": "MISSING",
    "checkedAt": "2026-08-13T10:39:55Z"
  },
  {
    "schemaVersion": "1.0",
    "toolId": "docker",
    "applicable": false,
    "found": false,
    "executable": null,
    "rawVersion": null,
    "normalizedVersion": null,
    "minimumVersion": null,
    "meetsMinimum": null,
    "candidateExecutables": [],
    "selectedScope": null,
    "selectionReason": "appliesWhen not satisfied by repository evidence",
    "status": "NOT_APPLICABLE",
    "checkedAt": "2026-08-13T10:39:55Z"
  },
  {
    "schemaVersion": "1.0",
    "toolId": "dotnet-apicompat",
    "applicable": false,
    "found": false,
    "executable": null,
    "rawVersion": null,
    "normalizedVersion": null,
    "minimumVersion": null,
    "meetsMinimum": null,
    "candidateExecutables": [],
    "selectedScope": null,
    "selectionReason": "appliesWhen not satisfied by repository evidence",
    "status": "NOT_APPLICABLE",
    "checkedAt": "2026-08-13T10:39:55Z"
  },
  {
    "schemaVersion": "1.0",
    "toolId": "ilspycmd",
    "applicable": false,
    "found": false,
    "executable": null,
    "rawVersion": null,
    "normalizedVersion": null,
    "minimumVersion": null,
    "meetsMinimum": null,
    "candidateExecutables": [],
    "selectedScope": null,
    "selectionReason": "appliesWhen not satisfied by repository evidence",
    "status": "NOT_APPLICABLE",
    "checkedAt": "2026-08-13T10:39:55Z"
  },
  {
    "schemaVersion": "1.0",
    "toolId": "typescript",
    "applicable": false,
    "found": false,
    "executable": null,
    "rawVersion": null,
    "normalizedVersion": null,
    "minimumVersion": null,
    "meetsMinimum": null,
    "candidateExecutables": [],
    "selectedScope": null,
    "selectionReason": "appliesWhen not satisfied by repository evidence",
    "status": "NOT_APPLICABLE",
    "checkedAt": "2026-08-13T10:39:55Z"
  },
  {
    "schemaVersion": "1.0",
    "toolId": "angular-cli",
    "applicable": false,
    "found": false,
    "executable": null,
    "rawVersion": null,
    "normalizedVersion": null,
    "minimumVersion": null,
    "meetsMinimum": null,
    "candidateExecutables": [],
    "selectedScope": null,
    "selectionReason": "appliesWhen not satisfied by repository evidence",
    "status": "NOT_APPLICABLE",
    "checkedAt": "2026-08-13T10:39:55Z"
  }
]